{
  "ticketId": "018f0f1e-7b31-7a00-8f42-31f9b25b1aff",
  "displayId": "INC-2999",
  "viewType": "EMPLOYEE_PUBLIC_VIEW",
  "items": [],
  "page": {
    "limit": 50,
    "hasMore": false,
    "nextCursor": null,
    "snapshotAt": "2026-07-25T20:00:00Z",
    "consistency": "SNAPSHOT"
  },
  "sort": {
    "version": 1,
    "fields": [
      "occurredAt:asc",
      "itemTypeRank:asc",
      "itemId:asc"
    ]
  }
}
